{
  "schema_version": "hetero-accel-sim-backend/v1",
  "backend_id": "gpu.accel_sim.sm86_rtx3070.v1_3_0",
  "executable": "/opt/gpu-atlas/dependencies/accel-sim-framework-c5296df152c99a28dd64e5d9560bd58a8fd2e774/gpu-simulator/bin/release/accel-sim.out",
  "gpgpu_config": "/opt/gpu-atlas/dependencies/accel-sim-framework-c5296df152c99a28dd64e5d9560bd58a8fd2e774/gpu-simulator/gpgpu-sim/configs/tested-cfgs/SM86_RTX3070/gpgpusim.config",
  "trace_config": "/opt/gpu-atlas/dependencies/accel-sim-framework-c5296df152c99a28dd64e5d9560bd58a8fd2e774/gpu-simulator/configs/tested-cfgs/SM86_RTX3070/trace.config",
  "target_gpu": "NVIDIA GeForce RTX 3070",
  "target_sm": 86,
  "core_frequency_hz": 1132000000,
  "timeout_seconds": 3600,
  "dependency_commits": {
    "accel_sim_framework": "c5296df152c99a28dd64e5d9560bd58a8fd2e774",
    "gpgpu_sim_distribution": "68e1cd30efaecbd71b496822f9d88a5803b33841"
  },
  "environment": {
    "LD_LIBRARY_PATH": "/opt/gpu-atlas/dependencies/accel-sim-framework-c5296df152c99a28dd64e5d9560bd58a8fd2e774/gpu-simulator/gpgpu-sim/lib/gcc-11.4.0/cuda-11080/release"
  }
}
